### ISSUE TITLE
no data showing up in influx db

### ISSUE THREAD

**Issue by nikor30** [javadmohebbi/nfCollector#4]
Hi, I can query the influx db it is set without user or pass.
But don´t see data coming in also when using nfcol-dump

2020/03/17 13:29:06 Job for measurement (sum_proto) Finished!
2020/03/17 13:30:04 Export job configs to send metrics to InfluxDB: 172.20.171.100:8086 (Database: netflowDB)
2020/03/17 13:30:04 Job for measurement (sum_proto_geo) Started!
2020/03/17 13:30:04 Job for measurement (sum_proto) Started!
2020/03/17 13:30:04 Deleting .done extension & rewrite suspended .working files in directory:  /tmp/nfcol/sum_proto_geo/
2020/03/17 13:30:04 Deleting .done extension & rewrite suspended .working files in directory:  /tmp/nfcol/sum_proto/
2020/03/17 13:30:06 Reading directory /tmp/nfcol/sum_proto_geo/
2020/03/17 13:30:06 Reading directory /tmp/nfcol/sum_proto/
2020/03/17 13:30:06 Adding .done extension to .metrics in directory:  /tmp/nfcol/sum_proto/
2020/03/17 13:30:06 Job for measurement (sum_proto) Finished!
2020/03/17 13:30:06 Adding .done extension to .metrics in directory:  /tmp/nfcol/sum_proto_geo/
2020/03/17 13:30:06 Job for measurement (sum_proto_geo) Finished!

**Comment by javadmohebbi** [comment]
> Hi, I can query the influx db it is set without user or pass.
> But don´t see data coming in also when using nfcol-dump
> 
> 2020/03/17 13:29:06 Job for measurement (sum_proto) Finished!
> 2020/03/17 13:30:04 Export job configs to send metrics to InfluxDB: 172.20.171.100:8086 (Database: netflowDB)
> 2020/03/17 13:30:04 Job for measurement (sum_proto_geo) Started!
> 2020/03/17 13:30:04 Job for measurement (sum_proto) Started!
> 2020/03/17 13:30:04 Deleting .done extension & rewrite suspended .working files in directory: /tmp/nfcol/sum_proto_geo/
> 2020/03/17 13:30:04 Deleting .done extension & rewrite suspended .working files in directory: /tmp/nfcol/sum_proto/
> 2020/03/17 13:30:06 Reading directory /tmp/nfcol/sum_proto_geo/
> 2020/03/17 13:30:06 Reading directory /tmp/nfcol/sum_proto/
> 2020/03/17 13:30:06 Adding .done extension to .metrics in directory: /tmp/nfcol/sum_proto/
> 2020/03/17 13:30:06 Job for measurement (sum_proto) Finished!
> 2020/03/17 13:30:06 Adding .done extension to .metrics in directory: /tmp/nfcol/sum_proto_geo/
> 2020/03/17 13:30:06 Job for measurement (sum_proto_geo) Finished!

Hi @nikor30 , Would you please share your `/etc/nfcol/nfc.yaml` ?

**Comment by nikor30** [comment]
```
# # # # # # # # # # # # # # # # # #

#       Netflow Collector         #
#         Configuration           #
# # # # # # # # # # # # # # # # # #
server:
  # Listen Address
  address: 0.0.0.0

  # Listen UDP Port
  port: 6859

  # If true, nfc will write flow data into stdout
  dump: false

  # Activate forwarder
  forwarder: true

  # Host to forward - Can be separated by ; (semi-colon) eg: 127.0.0.1;192.168.100.1
  forwarderHost: 127.0.0.1

  # Forwarder UDP Port
  forwarderPort: 7161

# # # # # # # # # # # # # # # # # #
#    IP2Location Configuration    #
# # # # # # # # # # # # # # # # # #
ip2location:
  # IP2Location command path
  cmd: /usr/local/bin/ip2location

  # Path to Local GEO Database. Read more at:
  #      https://github.com/javadmohebbi/IP2Location#local-database-format
  local: /etc/ip2location/local.csv

# # # # # # # # # # # # # # # # # #
#     Exporter Configuration      #
# # # # # # # # # # # # # # # # # #
exporter:
  # Enable if it's true
  enable: true

  # Currently Only InfluxDB (1.x) supported
  type: influxdb



# # # # # # # # # # # # # # # # # #
#     InfluxDB Configuration      #
# # # # # # # # # # # # # # # # # #
influxDB:
  # InfluxDB Host
  host: 172.20.171.100

  # InfluxDB Port
  port: 8086

  # InfluxDB Username. Can be null
  #username: #user

  # InfluxDB Password. Can be null
  #password: #secret

  # InfluxDB Database
  # InfluxDB command example for creating database:
  #       CREATE DATABASE "netflowDB" WITH DURATION 10d REPLICATION 1 SHARD DURATION 1h NAME "nfc"
  database: netflowDB

  # Temp Dir for InfluxDB Metrics. MUST be ended with / (Linux) or \ (Windows)
  tmpDir: /tmp/nfcol/


# # # # # # # # # # # # # # # # # #
#          Measurements           #
# # # # # # # # # # # # # # # # # #
measurements:
  # Netflow Summary Measurement Name
  summaryProto: sum_proto

  # Netflow GEO Summary Measurement Name
  summaryProtoGeo: sum_proto_geo
```

**Comment by nikor30** [comment]
Also here I did a test querry for the db but nothing is there
````
curl -G 'http://172.20.171.100:8086/query?db=netflowDB&pretty=true' --data-urlencode 'q=SELECT * FROM "netflowDB"'
{
    "results": [
        {
            "statement_id": 0
        }
    ]
}
```

**Comment by nikor30** [comment]
And here a tcpdum where i see flows comming in

```
09:59:21.964346 IP 62.134.255.194.irdmi > sdestoera2.global.web-int.net.6859: UDP, length 1464
09:59:21.964349 IP 62.134.255.194.irdmi > sdestoera2.global.web-int.net.6859: UDP, length 1272
09:59:21.964461 IP 62.134.255.194.irdmi > sdestoera2.global.web-int.net.6859: UDP, length 1464
09:59:21.964585 IP 62.134.255.194.irdmi > sdestoera2.global.web-int.net.6859: UDP, length 1464
09:59:21.964592 IP 62.134.255.194.irdmi > sdestoera2.global.web-int.net.6859: UDP, length 1272
09:59:21.964710 IP 62.134.255.194.irdmi > sdestoera2.global.web-int.net.6859: UDP, length 1464
09:59:21.964839 IP 62.134.255.194.irdmi > sdestoera2.global.web-int.net.6859: UDP, length 1464
09:59:21.964846 IP 62.134.255.194.irdmi > sdestoera2.global.web-int.net.6859: UDP, length 1272
09:59:21.964968 IP 62.134.255.194.irdmi > sdestoera2.global.web-int.net.6859: UDP, length 1464
09:59:21.964975 IP 62.134.255.194.irdmi > sdestoera2.global.web-int.net.6859: UDP, length 1464
09:59:21.964978 IP 62.134.255.194.irdmi > sdestoera2.global.web-int.net.6859: UDP, length 1272
09:59:21.965086 IP 62.134.255.194.irdmi > sdestoera2.global.web-int.net.6859: UDP, length 1464
09:59:21.965094 IP 62.134.255.194.irdmi > sdestoera2.global.web-int.net.6859: UDP, length 1176
^C
533 packets captured
533 packets received by filter
0 packets dropped by kernel
[root@sdestoera2 ~]# tcpdump port 6859
```

**Comment by javadmohebbi** [comment]
Hi @nikor30, Sorry for this delay, In my country these days are new year holiday & I did not work that much. 

Does your problem solved. Because everything seems fine. 

Would you please let me know what is the version of your netflow?
